{
  "$schema": "http://json-schema.org/draft-07/schema#",
  "$id": "https://liverig/rig_config.schema.json",
  "title": "LiveRig Configuration",
  "description": "Defines a rig's keyboards, parameter banks, patches, and stems so the controller no longer assumes a fixed 4-keyboard / 8-patch / 4-stem layout.",
  "type": "object",
  "required": ["version", "keyboards", "patches"],
  "additionalProperties": false,
  "properties": {
    "version": {
      "type": "string",
      "description": "Schema version, bump on breaking changes.",
      "default": "1.0"
    },
    "rigName": {
      "type": "string",
      "description": "Friendly name for this rig config, e.g. 'Main Live Rig' or 'Festival Backup'."
    },

    "keyboards": {
      "type": "array",
      "description": "Replaces the hardcoded KBD 1-4 pages. One entry per physical/virtual keyboard page.",
      "minItems": 1,
      "items": {
        "type": "object",
        "required": ["id", "label", "bankSize"],
        "additionalProperties": false,
        "properties": {
          "id": {
            "type": "string",
            "description": "Stable identifier, e.g. 'kbd1'. Used as a key elsewhere — do not reuse across keyboards."
          },
          "label": {
            "type": "string",
            "description": "Display name shown in the UI, e.g. 'KBD 1'."
          },
          "bankSize": {
            "type": "integer",
            "minimum": 1,
            "default": 8,
            "description": "Number of parameters walked per bank when paging through a device's parameters."
          },
          "midiChannel": {
            "type": "integer",
            "minimum": 1,
            "maximum": 16,
            "description": "1-indexed MIDI channel for this keyboard. Omit to auto-assign (ch1-4 for KBD1-4, then walking free channels skipping reserved ones)."
          },
          "defaultTrackBinding": {
            "type": ["string", "null"],
            "description": "Track name or index this keyboard binds to by default on load. Null = unbound until user selects a track.",
            "default": null
          },
          "buttonCount": {
            "type": "integer",
            "minimum": 0,
            "default": 16,
            "description": "Number of on/off buttons exposed by this keyboard page (replaces hardcoded 16)."
          },
          "faderCount": {
            "type": "integer",
            "minimum": 0,
            "default": 8,
            "description": "Number of continuous faders exposed by this keyboard page (replaces hardcoded 8)."
          },
          "faderRange": {
            "type": "object",
            "description": "MIDI CC value range for faders on this page.",
            "properties": {
              "min": { "type": "integer", "default": 0 },
              "max": { "type": "integer", "default": 127 }
            },
            "additionalProperties": false
          }
        }
      }
    },

    "patches": {
      "type": "object",
      "description": "Replaces hardcoded 8-patch assumption for snapshot/rename feature.",
      "required": ["maxPatches"],
      "additionalProperties": false,
      "properties": {
        "maxPatches": {
          "type": "integer",
          "minimum": 1,
          "default": 8,
          "description": "Number of patch slots available for CAPTURE/RENAME."
        },
        "restoreAnimation": {
          "type": "object",
          "description": "Tuning for the fader-restore animation when a patch is recalled.",
          "additionalProperties": false,
          "properties": {
            "durationMs": { "type": "integer", "default": 500 },
            "easing": { "type": "string", "default": "ease-out-cubic" },
            "stepIntervalMs": { "type": "integer", "default": 20 },
            "stepCount": { "type": "integer", "default": 25 }
          }
        },
        "captureScope": {
          "type": "array",
          "description": "Which keyboard ids are eligible as a capture/restore scope. Defaults to all keyboard ids in this config.",
          "items": { "type": "string" }
        }
      }
    },

    "stems": {
      "type": "array",
      "description": "Replaces hardcoded 4-stem assumption. Empty/omitted if this rig doesn't use stem control.",
      "items": {
        "type": "object",
        "required": ["id", "label", "trackName"],
        "additionalProperties": false,
        "properties": {
          "id": { "type": "string" },
          "label": { "type": "string" },
          "trackName": {
            "type": ["string", "null"],
            "description": "Ableton track name this stem control targets (case-insensitive match). Null = slot deliberately unconfigured."
          },
          "defaultVolume": {
            "type": "number",
            "minimum": 0,
            "maximum": 127,
            "default": 100
          }
        }
      }
    },

    "loopers": {
      "type": "array",
      "description": "Dedicated Looper-device tracks controlled from the Looper page. Omit if unused.",
      "items": {
        "type": "object",
        "required": ["id", "label"],
        "additionalProperties": false,
        "properties": {
          "id": { "type": "string" },
          "label": { "type": "string" },
          "trackName": {
            "type": ["string", "null"],
            "description": "Ableton track holding the Looper device (case-insensitive match)."
          }
        }
      }
    },

    "markerTrack": {
      "type": ["string", "null"],
      "description": "Name of the Arrangement track whose named clips define song sections (feeds the Transport section strip and lighting cues). Case-insensitive match."
    },

    "mainstage": {
      "type": "object",
      "description": "MainStage mode (2026-08-15): a dedicated two-way MSTG page. Patch buttons send Program Change, faders CC1..N, toggles CC20.., all on midiChannel. Feedback comes from MainStage Layout-mode screen controls with 'Send Value to' pointed at the LiveRig Bridge port -- see docs/MAINSTAGE_MODE.md.",
      "additionalProperties": false,
      "properties": {
        "enabled": { "type": "boolean", "default": false, "description": "Show the MSTG tab and intercept feedback CCs on midiChannel." },
        "midiChannel": {
          "type": "integer", "minimum": 1, "maximum": 16, "default": 14,
          "description": "1-indexed dedicated channel. Default 14: unused by KBD auto-assign below 10 keyboards and not in the reserved set. Do NOT set to a channel used elsewhere (kbd/stems ch6/FX ch7/pads ch10/Blue Hand ch15/transport ch16)."
        },
        "patchCount":  { "type": "integer", "minimum": 1, "maximum": 128, "default": 8 },
        "faderCount":  { "type": "integer", "minimum": 0, "maximum": 16,  "default": 8 },
        "buttonCount": { "type": "integer", "minimum": 0, "maximum": 16,  "default": 8 }
      }
    },

    "lighting": {
      "type": "object",
      "description": "OSC lighting cues fired by the bridge when the playhead enters a new markerTrack section (2026-07-06). Console-agnostic: works with anything listening for OSC (grandMA3, Eos, ChamSys, Onyx, Lightkey, QLC+, Resolume...).",
      "additionalProperties": false,
      "properties": {
        "enabled": {
          "type": "boolean",
          "default": false,
          "description": "Master switch. When false (or the whole lighting key is absent), the bridge sends nothing."
        },
        "oscHost": {
          "type": "string",
          "default": "127.0.0.1",
          "description": "IP/hostname of the lighting console or software."
        },
        "oscPort": {
          "type": "integer",
          "default": 8000,
          "description": "UDP port the console listens for OSC on."
        },
        "sendSectionName": {
          "type": "boolean",
          "default": true,
          "description": "Send /liverig/section <name(string)> <index(int)> on every section change (index -1 / empty name = outside all sections)."
        },
        "sendProgress": {
          "type": "boolean",
          "default": false,
          "description": "Also stream /liverig/progress <0.0-1.0(float)> ~10 Hz while playing -- lets the console run timed fades across a section."
        },
        "cues": {
          "type": "object",
          "description": "Optional per-section console-specific messages, keyed by section name (case-insensitive). Value is either an OSC address string, or {address, args} with int/float/string args.",
          "additionalProperties": {
            "anyOf": [
              { "type": "string" },
              {
                "type": "object",
                "required": ["address"],
                "additionalProperties": false,
                "properties": {
                  "address": { "type": "string" },
                  "args": {
                    "type": "array",
                    "items": { "type": ["integer", "number", "string", "boolean"] }
                  }
                }
              }
            ]
          }
        }
      }
    },

    "listeners": {
      "type": "object",
      "description": "Global guardrails learned the hard way — keep these enforced regardless of rig size.",
      "additionalProperties": false,
      "properties": {
        "useSchedulePollForSongTime": {
          "type": "boolean",
          "default": true,
          "description": "current_song_time fires per audio block; must be polled via schedule_message, never subscribed directly."
        },
        "songTimePollHz": {
          "type": "integer",
          "default": 10
        },
        "wrapListenersInTryExcept": {
          "type": "boolean",
          "default": true,
          "description": "Every listener subscription must be defensively wrapped to avoid 'Observer already connected' errors."
        }
      }
    }
  }
}
