{
  "version": "1.0",
  "rigName": "Main Live Rig",
  "keyboards": [
    {
      "id": "kbd1",
      "label": "MAIN KEYS",
      "bankSize": 8,
      "midiChannel": 1,
      "defaultTrackBinding": "MAIN KEYS",
      "buttonCount": 16,
      "faderCount": 8,
      "faderRange": {
        "min": 0,
        "max": 127
      }
    },
    {
      "id": "kbd2",
      "label": "TOP KEYS",
      "bankSize": 8,
      "midiChannel": 2,
      "defaultTrackBinding": "TOP KEYS",
      "buttonCount": 16,
      "faderCount": 8,
      "faderRange": {
        "min": 0,
        "max": 127
      }
    },
    {
      "id": "kbd3",
      "label": "KEYS L",
      "bankSize": 8,
      "midiChannel": 3,
      "defaultTrackBinding": "KEYS L",
      "buttonCount": 16,
      "faderCount": 8,
      "faderRange": {
        "min": 0,
        "max": 127
      }
    },
    {
      "id": "kbd4",
      "label": "KEYS R",
      "bankSize": 8,
      "midiChannel": 4,
      "defaultTrackBinding": "KEYS R",
      "buttonCount": 16,
      "faderCount": 8,
      "faderRange": {
        "min": 0,
        "max": 127
      }
    }
  ],
  "patches": {
    "maxPatches": 8,
    "restoreAnimation": {
      "durationMs": 500,
      "easing": "ease-out-cubic",
      "stepIntervalMs": 20,
      "stepCount": 25
    },
    "captureScope": [
      "kbd1",
      "kbd2",
      "kbd3",
      "kbd4"
    ]
  },
  "stems": [
    {
      "id": "stem1",
      "label": "Stem 1",
      "trackName": "DRUMS",
      "defaultVolume": 100
    },
    {
      "id": "stem2",
      "label": "Stem 2",
      "trackName": "PERC/LOOP",
      "defaultVolume": 100
    },
    {
      "id": "stem3",
      "label": "Stem 3",
      "trackName": "BASS",
      "defaultVolume": 100
    },
    {
      "id": "stem4",
      "label": "Stem 4",
      "trackName": "GTR",
      "defaultVolume": 100
    },
    {
      "id": "stem5",
      "label": "Stem 5",
      "trackName": "AUX",
      "defaultVolume": 100
    },
    {
      "id": "stem6",
      "label": "Stem 6",
      "trackName": "FX",
      "defaultVolume": 100
    },
    {
      "id": "stem7",
      "label": "Stem 7",
      "trackName": "VOCALS",
      "defaultVolume": 100
    },
    {
      "id": "stem8",
      "label": "Stem 8",
      "trackName": "LEAD VOCALS",
      "defaultVolume": 100
    },
    {
      "id": "stem9",
      "label": "CLICK",
      "trackName": "CLICK",
      "defaultVolume": 100
    },
    {
      "id": "stem10",
      "label": "GUIDE",
      "trackName": "GUIDE",
      "defaultVolume": 100
    }
  ],
  "loopers": [
    {
      "id": "loop1",
      "label": "Loop 1",
      "trackName": "Loop 1"
    },
    {
      "id": "loop2",
      "label": "Loop 2",
      "trackName": "Loop 2"
    },
    {
      "id": "loop3",
      "label": "Loop 3",
      "trackName": "Loop 3"
    },
    {
      "id": "loop4",
      "label": "Loop 4",
      "trackName": "Loop 4"
    }
  ],
  "markerTrack": "MARKERS",
  "mainstage": {
    "enabled": true,
    "midiChannel": 14,
    "patchCount": 8,
    "faderCount": 8,
    "buttonCount": 8
  },
  "lighting": {
    "enabled": false,
    "oscHost": "127.0.0.1",
    "oscPort": 8000,
    "sendSectionName": true,
    "sendProgress": false,
    "cues": {}
  },
  "listeners": {
    "useSchedulePollForSongTime": true,
    "songTimePollHz": 10,
    "wrapListenersInTryExcept": true
  }
}
